{
  "id": "example:GB:EXA:TARIFF-DC",
  "currency": "GBP",
  "type": "regular",
  "elements": [
    {
      "price_components": [
        {
          "type": "energy",
          "price": 0.55,
          "vat": 20.0,
          "step_size": 1
        }
      ],
      "restrictions": {
        "start_time": "00:00",
        "end_time": "07:00",
        "start_date": null,
        "end_date": null,
        "min_kwh": null,
        "max_kwh": null,
        "min_current": null,
        "max_current": null,
        "min_power": null,
        "max_power": null,
        "min_duration": null,
        "max_duration": null,
        "day_of_week": [],
        "reservation": null
      }
    },
    {
      "price_components": [
        {
          "type": "energy",
          "price": 0.65,
          "vat": 20.0,
          "step_size": 1
        }
      ],
      "restrictions": null
    }
  ],
  "min_price": null,
  "max_price": null,
  "alt_text": "Synthetic example: 55p per kWh overnight, 65p per kWh otherwise, excluding VAT.",
  "alt_url": null,
  "start_date_time": null,
  "end_date_time": null,
  "last_updated": "2026-10-01T00:00:00Z",
  "price_state": "priced",
  "provenance": {
    "source_id": "example",
    "source_url": "https://example.invalid/ocpi/tariffs",
    "licence": "OGL-3.0",
    "fetched_at": "2026-10-06T09:05:00Z",
    "last_confirmed_at": "2026-10-06T09:05:00Z",
    "method": "operator_feed",
    "confidence": "high"
  }
}
